2025.12.30
1、增加了输入文本框的右键菜单，包括粘贴、剪切、复制、全选、删除；
2、修复了窗口无法跟随主窗口尺寸变化的问题；
3、修改了apply按键的逻辑，如果未选中8位的二进制就按下按键则会弹出提醒，而不是直接运行导致报错；
4、修改了菜单栏about菜单的buy me coffee的图片加载方式，现在图片的二进制数据不再包含在代码中，避免代码过长；
5、修改了启动时对A0/2h_bits_explanation.txt的加载逻辑，要求exe所在文件夹必须要有这2个文件才能显示 bits explanation。


2025.12.29
1、增加了可以处理的文本格式，现在以下几种格式的内容全部放入A0h input文本框，可以直接解析。
2、增加了解析逻辑，如果在A0h input文本框中放入的内容超过了256byte，则会自动将超过的byte放入A2h文本框中解析。

格式1:

03 04 07 00 00 00 00 00 00 00 00 06 ff 00 0a 64
00 00 00 00 45 52 49 43 53 53 4f 4e 20 20 20 20
20 20 20 20 03 00 1c ad 52 54 58 4d 33 33 30 2d
32 30 31 2d 43 32 34 41 32 2e 30 20 05 1e 00 3e
18 3a 67 00 43 55 38 32 33 47 30 56 34 59 20 20
20 20 20 20 32 33 30 37 31 38 20 20 68 f8 08 e5
4d 4f 4e 49 18 00 00 00 00 00 fe 6f 3c c0 75 03
2f 33 20 20 20 20 01 01 52 44 48 31 30 32 37 35
00 00 00 00 00 00 00 00 00 00 00 00 00 00 00 00
00 00 00 00 00 00 00 00 00 00 00 00 00 00 00 00
00 00 00 00 00 00 00 00 00 00 00 00 00 00 00 00
00 00 00 00 00 00 00 00 00 00 00 00 00 00 00 00
00 00 00 00 00 00 00 00 00 00 00 00 00 00 00 00
00 00 00 00 00 00 00 00 00 00 00 00 00 00 00 00
00 00 00 00 00 00 00 00 00 00 00 00 00 00 00 00
00 00 00 00 00 00 00 00 00 00 00 00 00 00 00 00
5d 00 d0 00 58 00 d5 00 8d cc 74 04 88 a4 79 2c
c3 50 13 88 af c8 1d 4c 62 1f 07 cb 4d f1 09 d0
62 1f 01 63 4d f1 01 bf 00 00 00 00 00 00 00 00
00 00 00 00 00 00 00 00 00 00 00 00 00 00 00 00
00 00 00 00 3f 80 00 00 00 00 00 00 01 00 00 00
01 00 00 00 01 00 00 00 01 00 00 00 00 00 00 9a
21 a4 7f 86 45 ea 1f 01 10 5b 00 00 00 00 00 00
00 00 00 00 00 00 80 00 00 00 00 ff ff ff ff 00
52 00 43 52 54 55 41 47 4c 4c 41 41 52 44 48 31
30 32 37 35 2f 33 20 20 20 20 20 20 01 00 00 00
00 00 00 00 00 00 ec e3 00 00 00 00 00 00 00 00
00 00 00 00 00 00 00 00 00 00 00 00 00 00 00 00
00 00 00 00 00 00 00 00 00 00 00 00 00 00 00 00
00 00 00 00 00 00 00 00 00 00 00 00 00 00 00 00
00 00 00 00 00 00 00 00 00 00 00 00 00 00 00 00
00 00 00 00 00 00 00 00 00 00 00 00 00 00 00 00

格式2:

root@radio2267:~# 
root@radio2267:~# i2cdump -f -y 0 0x50
i2cdump -f -y 0 0x50
No size specified (using byte-data access)
     0  1  2  3  4  5  6  7  8  9  a  b  c  d  e  f    0123456789abcdef
00: 03 04 07 00 00 00 00 00 00 00 00 06 ff 00 0a 64    ???........?..?d
10: 00 00 00 00 45 52 49 43 53 53 4f 4e 20 20 20 20    ....ERICSSON    
20: 20 20 20 20 03 00 1c ad 52 54 58 4d 33 33 30 2d        ?.??RTXM330-
30: 32 30 31 2d 43 32 34 41 32 2e 30 20 05 1e 00 3e    201-C24A2.0 ??.>
40: 18 3a 67 00 43 55 38 32 33 47 30 56 34 59 20 20    ?:g.CU823G0V4Y  
50: 20 20 20 20 32 33 30 37 31 38 20 20 68 f8 08 e5        230718  h???
60: 4d 4f 4e 49 18 00 00 00 00 00 fe 6f 3c c0 75 03    MONI?.....?o<?u?
70: 2f 33 20 20 20 20 01 01 52 44 48 31 30 32 37 35    /3    ??RDH10275
80: 00 00 00 00 00 00 00 00 00 00 00 00 00 00 00 00    ................
90: 00 00 00 00 00 00 00 00 00 00 00 00 00 00 00 00    ................
a0: 00 00 00 00 00 00 00 00 00 00 00 00 00 00 00 00    ................
b0: 00 00 00 00 00 00 00 00 00 00 00 00 00 00 00 00    ................
c0: 00 00 00 00 00 00 00 00 00 00 00 00 00 00 00 00    ................
d0: 00 00 00 00 00 00 00 00 00 00 00 00 00 00 00 00    ................
e0: 00 00 00 00 00 00 00 00 00 00 00 00 00 00 00 00    ................
f0: 00 00 00 00 00 00 00 00 00 00 00 00 00 00 00 00    ................
root@radio2267:~# i2cdump -f -y 0 0x51
i2cdump -f -y 0 0x51
No size specified (using byte-data access)
     0  1  2  3  4  5  6  7  8  9  a  b  c  d  e  f    0123456789abcdef
00: 5d 00 d0 00 58 00 d5 00 8d cc 74 04 88 a4 79 2c    ].?.X.?.??t???y,
10: c3 50 13 88 af c8 1d 4c 62 1f 07 cb 4d f1 09 d0    ?P?????Lb???M???
20: 62 1f 01 63 4d f1 01 bf 00 00 00 00 00 00 00 00    b??cM???........
30: 00 00 00 00 00 00 00 00 00 00 00 00 00 00 00 00    ................
40: 00 00 00 00 3f 80 00 00 00 00 00 00 01 00 00 00    ....??......?...
50: 01 00 00 00 01 00 00 00 01 00 00 00 00 00 00 9a    ?...?...?......?
60: 21 a4 7f 86 45 ea 1f 01 10 5b 00 00 00 00 00 00    !???E????[......
70: 00 00 00 00 00 00 80 00 00 00 00 ff ff ff ff 00    ......?.........
80: 52 00 43 52 54 55 41 47 4c 4c 41 41 52 44 48 31    R.CRTUAGLLAARDH1
90: 30 32 37 35 2f 33 20 20 20 20 20 20 01 00 00 00    0275/3      ?...
a0: 00 00 00 00 00 00 ec e3 00 00 00 00 00 00 00 00    ......??........
b0: 00 00 00 00 00 00 00 00 00 00 00 00 00 00 00 00    ................
c0: 00 00 00 00 00 00 00 00 00 00 00 00 00 00 00 00    ................
d0: 00 00 00 00 00 00 00 00 00 00 00 00 00 00 00 00    ................
e0: 00 00 00 00 00 00 00 00 00 00 00 00 00 00 00 00    ................
f0: 00 00 00 00 00 00 00 00 00 00 00 00 00 00 00 00    ................

格式3:

Print 128 bytes of data from SFP device 0 and EEPROM/A0h page 00h



Address Data                                Data

Hex     Hex                                 Bin

----    -------- -------- -------- -------- ------------------

0000    03040720 00000012 00014006 67000A64 "... ......@.g..d"

0010    00000000 44454C54 41202020 20202020 "....DELTA       "

0020    20202020 0020F85E 4C43502D 31304733 "    . .^LCP-10G3"

0030    42345144 524D4533 41202020 051E0069 "B4QDRME3A   ...i"

0040    001A0058 31383431 30393241 31353030 "...X1841092A1500"

0050    30333520 31383130 31323031 68F00888 "035 18101201h..."

0060    4D4F4E49 18000000 00401400 14805500 "MONI.....@....U."

0070    2F332020 20200101 52444831 30323635 "/3    ..RDH10265"



Print 128 bytes of data from SFP device 0 and EEPROM/A0h page 01h



Address Data                                Data

Hex     Hex                                 Bin

----    -------- -------- -------- -------- ------------------

0080    00000000 00000000 00000000 00000000 "................"

0090    00000000 00000000 00000000 00000000 "................"

00A0    00000000 00000000 00000000 00000000 "................"

00B0    00000000 00000000 00000000 00000000 "................"

00C0    00000000 00000000 00000000 00000000 "................"

00D0    00000000 00000000 00000000 00000000 "................"

00E0    00000000 00000000 00000000 00000000 "................"

00F0    00000000 00000000 00000000 00000000 "................"


格式4:

A0h

03 04 07 00 00 00 00 00 00 00 00 06 ff 00 0a 64
00 00 00 00 45 52 49 43 53 53 4f 4e 20 20 20 20
20 20 20 20 03 00 1c ad 52 54 58 4d 33 33 30 2d
32 30 31 2d 43 32 34 41 32 2e 30 20 05 1e 00 3e
18 3a 67 00 43 55 38 32 33 47 30 53 4d 54 20 20
20 20 20 20 32 33 30 37 31 37 20 20 68 f8 08 f5
4d 4f 4e 49 18 00 00 00 00 00 fe 6f 3c c0 75 03
2f 33 20 20 20 20 01 01 52 44 48 31 30 32 37 35
00 00 00 00 00 00 00 00 00 00 00 00 00 00 00 00
00 00 00 00 00 00 00 00 00 00 00 00 00 00 00 00
00 00 00 00 00 00 00 00 00 00 00 00 00 00 00 00
00 00 00 00 00 00 00 00 00 00 00 00 00 00 00 00
00 00 00 00 00 00 00 00 00 00 00 00 00 00 00 00
00 00 00 00 00 00 00 00 00 00 00 00 00 00 00 00
00 00 00 00 00 00 00 00 00 00 00 00 00 00 00 00
00 00 00 00 00 00 00 00 00 00 00 00 00 00 00 00

A2h

5d 00 d0 00 58 00 d5 00 8d cc 74 04 88 a4 79 2c
c3 50 13 88 af c8 1d 4c 62 1f 07 cb 4d f1 09 d0
62 1f 01 63 4d f1 01 bf 00 00 00 00 00 00 00 00
00 00 00 00 00 00 00 00 00 00 00 00 00 00 00 00
00 00 00 00 3f 80 00 00 00 00 00 00 01 00 00 00
01 00 00 00 01 00 00 00 01 00 00 00 00 00 00 9a
22 d2 7f 9d 45 ea 22 2a 0c 30 00 00 00 00 00 00
00 00 00 00 00 00 80 00 00 00 00 ff ff ff ff 00
52 00 43 52 54 55 41 47 4c 4c 41 41 52 44 48 31
30 32 37 35 2f 33 20 20 20 20 20 20 01 00 00 00
00 00 00 00 00 00 ec e3 00 00 00 00 00 00 00 00
00 00 00 00 00 00 00 00 00 00 00 00 00 00 00 00
00 00 00 00 00 00 00 00 00 00 00 00 00 00 00 00
00 00 00 00 00 00 00 00 00 00 00 00 00 00 00 00
00 00 00 00 00 00 00 00 00 00 00 00 00 00 00 00
00 00 00 00 00 00 00 00 00 00 00 00 00 00 00 00

格式5:

A0h

03040720 00000012 00014006 67000A64

00000000 44454C54 41202020 20202020

20202020 0020F85E 4C43502D 31304733

42345144 524D4533 41202020 051E0069

001A0058 31383431 30393241 31353030

30333520 31383130 31323031 68F00888

4D4F4E49 18000000 00401400 14805500

2F332020 20200101 52444831 30323635

00000000 00000000 00000000 00000000

00000000 00000000 00000000 00000000

00000000 00000000 00000000 00000000

00000000 00000000 00000000 00000000

00000000 00000000 00000000 00000000

00000000 00000000 00000000 00000000

00000000 00000000 00000000 00000000

00000000 00000000 00000000 00000000

A2h

5D00D000 5800D500 8DCC7404 88A4792C

9C4007D0 8CA00BB8 457703BB 372D04B2

457700E5 372D0120 00000000 00000000

00000000 00000000 00000000 00000000

00000000 3F800000 00000000 01000000

01000000 01000000 01000000 0000001B

229B8051 47C91AD3 13430000 00000000

0000AA00 00000000 00000000 00000000

52004352 54554145 504C4141 52444831

30323635 2F332020 20202020 01000000

00000000 00002857 FFFFFFFF FFFFFFFF

FFFFFFFF FFFFFFFF FFFFFFFF FFFFFFFF

FFFFFFFF FFFFFFFF FFFFFFFF FFFFFFFF

FFFFFFFF FFFFFFFF FFFFFFFF FFFFFFFF

FFFFFFFF FFFFFFFF FFFFFFFF FFFFFFFF

FFFFFFFF FFFFFFFF FFFFFFFF FFFFFFFF